{
 "Education": "Home Schooling",
 "Gender Expression": "Transgender Female",
 "Genetic Population": "Eastern European",
 "Occupation": "Life, Physical, and Social Science",
 "Religion": "Zoroastrianism",
 "Sexuality": "Homosexual",
 "anxious - calm": "extremely anxious",
 "apolitical - activist": "mildly activist",
 "asexual - hypersexual": "moderately hypersexual",
 "authoritarian - libertarian": "moderately authoritarian",
 "competitive - collaborative": "moderately collaborative",
 "conservative - progressive": "extremely conservative",
 "destitute - wealthy": "extremely destitute",
 "difficult childhood - stable childhood": "moderately difficult childhood",
 "emotionally cold - loving": "extremely loving",
 "emotionally sensitive - emotionally robust": "moderately emotionally sensitive",
 "gullible - critical": "moderately gullible",
 "impulsive - thoughtful": "mildly thoughtful",
 "incurious - curious": "mildly curious",
 "individualist - collectivist": "moderately collectivist",
 "introverted - extroverted": "moderately introverted",
 "lazy - ambitious": "extremely lazy",
 "misogynistic - egalitarian": "moderately egalitarian",
 "pessimistic - optimistic": "moderately pessimistic",
 "profile": "Education: Home Schooling\nGender Expression: Transgender Female\nGenetic Population: Eastern European\nOccupation: Life, Physical, and Social Science\nReligion: Zoroastrianism\nSexuality: Homosexual\nI am moderately generous.\nI am mildly curious.\nI am extremely secular.\nI am moderately pessimistic.\nI am moderately gullible.\nI am extremely forgiving.\nI am extremely lazy.\nI am moderately introverted.\nI am mildly playful.\nI am extremely flexible.\nI am mildly thoughtful.\nI am moderately authoritarian.\nI am extremely conservative.\nI am mildly activist.\nI am moderately egalitarian.\nI am extremely inclusive.\nI am extremely anxious.\nI am extremely vain.\nI am extremely peaceful.\nI am mildly kind.\nI am moderately emotionally sensitive.\nI am mildly healthy.\nI am extremely contemporary.\nI am moderately hypersexual.\nI am moderately collaborative.\nI am moderately collectivist.\nI am extremely loving.\nI am moderately difficult childhood.\nI am extremely young.\nI am extremely destitute.\n",
 "racist - inclusive": "extremely inclusive",
 "secular - spiritual": "extremely secular",
 "selfish - generous": "moderately generous",
 "serious - playful": "mildly playful",
 "stubborn - flexible": "extremely flexible",
 "traditional - contemporary": "extremely contemporary",
 "unhealthy - healthy": "mildly healthy",
 "unkind - kind": "mildly kind",
 "vain - humble": "extremely vain",
 "vengeful - forgiving": "extremely forgiving",
 "violent - peaceful": "extremely peaceful",
 "young - old": "extremely young"
}