{
 "Education": "Skilled Trade",
 "Gender Expression": "Non-binary Female",
 "Genetic Population": "North African",
 "Occupation": "Life, Physical, and Social Science",
 "Religion": "Islam",
 "Sexuality": "Heterosexual",
 "anxious - calm": "moderately calm",
 "apolitical - activist": "moderately apolitical",
 "asexual - hypersexual": "extremely hypersexual",
 "authoritarian - libertarian": "mildly libertarian",
 "competitive - collaborative": "mildly collaborative",
 "conservative - progressive": "moderately conservative",
 "destitute - wealthy": "extremely destitute",
 "difficult childhood - stable childhood": "moderately difficult childhood",
 "emotionally cold - loving": "extremely loving",
 "emotionally sensitive - emotionally robust": "mildly emotionally sensitive",
 "gullible - critical": "mildly critical",
 "impulsive - thoughtful": "moderately thoughtful",
 "incurious - curious": "extremely incurious",
 "individualist - collectivist": "mildly collectivist",
 "introverted - extroverted": "mildly extroverted",
 "lazy - ambitious": "mildly ambitious",
 "misogynistic - egalitarian": "mildly misogynistic",
 "pessimistic - optimistic": "moderately optimistic",
 "profile": "Education: Skilled Trade\nGender Expression: Non-binary Female\nGenetic Population: North African\nOccupation: Life, Physical, and Social Science\nReligion: Islam\nSexuality: Heterosexual\nI am moderately selfish.\nI am extremely incurious.\nI am extremely secular.\nI am moderately optimistic.\nI am mildly critical.\nI am extremely forgiving.\nI am mildly ambitious.\nI am mildly extroverted.\nI am moderately serious.\nI am extremely flexible.\nI am moderately thoughtful.\nI am mildly libertarian.\nI am moderately conservative.\nI am moderately apolitical.\nI am mildly misogynistic.\nI am mildly inclusive.\nI am moderately calm.\nI am extremely humble.\nI am mildly peaceful.\nI am extremely kind.\nI am mildly emotionally sensitive.\nI am mildly healthy.\nI am mildly contemporary.\nI am extremely hypersexual.\nI am mildly collaborative.\nI am mildly collectivist.\nI am extremely loving.\nI am moderately difficult childhood.\nI am mildly young.\nI am extremely destitute.\n",
 "racist - inclusive": "mildly inclusive",
 "secular - spiritual": "extremely secular",
 "selfish - generous": "moderately selfish",
 "serious - playful": "moderately serious",
 "stubborn - flexible": "extremely flexible",
 "traditional - contemporary": "mildly contemporary",
 "unhealthy - healthy": "mildly healthy",
 "unkind - kind": "extremely kind",
 "vain - humble": "extremely humble",
 "vengeful - forgiving": "extremely forgiving",
 "violent - peaceful": "mildly peaceful",
 "young - old": "mildly young"
}