{
 "Education": "Postsecondary Education",
 "Gender Expression": "Non-binary Male",
 "Genetic Population": "Sub-Saharan African",
 "Occupation": "Computer and Mathematical",
 "Religion": "Hinduism",
 "Sexuality": "Heterosexual",
 "anxious - calm": "extremely calm",
 "apolitical - activist": "moderately activist",
 "asexual - hypersexual": "extremely hypersexual",
 "authoritarian - libertarian": "mildly libertarian",
 "competitive - collaborative": "extremely collaborative",
 "conservative - progressive": "moderately conservative",
 "destitute - wealthy": "mildly wealthy",
 "difficult childhood - stable childhood": "mildly difficult childhood",
 "emotionally cold - loving": "mildly loving",
 "emotionally sensitive - emotionally robust": "mildly emotionally robust",
 "gullible - critical": "extremely critical",
 "impulsive - thoughtful": "mildly thoughtful",
 "incurious - curious": "mildly incurious",
 "individualist - collectivist": "extremely collectivist",
 "introverted - extroverted": "moderately introverted",
 "lazy - ambitious": "moderately ambitious",
 "misogynistic - egalitarian": "moderately misogynistic",
 "pessimistic - optimistic": "mildly optimistic",
 "profile": "Education: Postsecondary Education\nGender Expression: Non-binary Male\nGenetic Population: Sub-Saharan African\nOccupation: Computer and Mathematical\nReligion: Hinduism\nSexuality: Heterosexual\nI am extremely selfish.\nI am mildly incurious.\nI am moderately spiritual.\nI am mildly optimistic.\nI am extremely critical.\nI am moderately forgiving.\nI am moderately ambitious.\nI am moderately introverted.\nI am extremely serious.\nI am extremely stubborn.\nI am mildly thoughtful.\nI am mildly libertarian.\nI am moderately conservative.\nI am moderately activist.\nI am moderately misogynistic.\nI am extremely inclusive.\nI am extremely calm.\nI am mildly humble.\nI am mildly violent.\nI am extremely unkind.\nI am mildly emotionally robust.\nI am moderately healthy.\nI am moderately contemporary.\nI am extremely hypersexual.\nI am extremely collaborative.\nI am extremely collectivist.\nI am mildly loving.\nI am mildly difficult childhood.\nI am extremely young.\nI am mildly wealthy.\n",
 "racist - inclusive": "extremely inclusive",
 "secular - spiritual": "moderately spiritual",
 "selfish - generous": "extremely selfish",
 "serious - playful": "extremely serious",
 "stubborn - flexible": "extremely stubborn",
 "traditional - contemporary": "moderately contemporary",
 "unhealthy - healthy": "moderately healthy",
 "unkind - kind": "extremely unkind",
 "vain - humble": "mildly humble",
 "vengeful - forgiving": "moderately forgiving",
 "violent - peaceful": "mildly violent",
 "young - old": "extremely young"
}