{
 "Education": "Postsecondary Education",
 "Gender Expression": "Genderqueer Male",
 "Genetic Population": "Australian",
 "Occupation": "Legal",
 "Religion": "Buddhism",
 "Sexuality": "Homosexual",
 "anxious - calm": "moderately anxious",
 "apolitical - activist": "mildly activist",
 "asexual - hypersexual": "extremely hypersexual",
 "authoritarian - libertarian": "extremely authoritarian",
 "competitive - collaborative": "extremely competitive",
 "conservative - progressive": "moderately conservative",
 "destitute - wealthy": "mildly destitute",
 "difficult childhood - stable childhood": "extremely difficult childhood",
 "emotionally cold - loving": "extremely loving",
 "emotionally sensitive - emotionally robust": "mildly emotionally sensitive",
 "gullible - critical": "extremely critical",
 "impulsive - thoughtful": "moderately thoughtful",
 "incurious - curious": "extremely curious",
 "individualist - collectivist": "moderately individualist",
 "introverted - extroverted": "moderately introverted",
 "lazy - ambitious": "moderately ambitious",
 "misogynistic - egalitarian": "extremely egalitarian",
 "pessimistic - optimistic": "mildly pessimistic",
 "profile": "Education: Postsecondary Education\nGender Expression: Genderqueer Male\nGenetic Population: Australian\nOccupation: Legal\nReligion: Buddhism\nSexuality: Homosexual\nI am moderately generous.\nI am extremely curious.\nI am moderately spiritual.\nI am mildly pessimistic.\nI am extremely critical.\nI am moderately vengeful.\nI am moderately ambitious.\nI am moderately introverted.\nI am moderately playful.\nI am extremely flexible.\nI am moderately thoughtful.\nI am extremely authoritarian.\nI am moderately conservative.\nI am mildly activist.\nI am extremely egalitarian.\nI am moderately inclusive.\nI am moderately anxious.\nI am moderately humble.\nI am moderately peaceful.\nI am moderately kind.\nI am mildly emotionally sensitive.\nI am moderately unhealthy.\nI am extremely traditional.\nI am extremely hypersexual.\nI am extremely competitive.\nI am moderately individualist.\nI am extremely loving.\nI am extremely difficult childhood.\nI am extremely young.\nI am mildly destitute.\n",
 "racist - inclusive": "moderately inclusive",
 "secular - spiritual": "moderately spiritual",
 "selfish - generous": "moderately generous",
 "serious - playful": "moderately playful",
 "stubborn - flexible": "extremely flexible",
 "traditional - contemporary": "extremely traditional",
 "unhealthy - healthy": "moderately unhealthy",
 "unkind - kind": "moderately kind",
 "vain - humble": "moderately humble",
 "vengeful - forgiving": "moderately vengeful",
 "violent - peaceful": "moderately peaceful",
 "young - old": "extremely young"
}