{
 "Education": "Skilled Trade",
 "Gender Expression": "Transgender Female",
 "Genetic Population": "Scandinavian",
 "Occupation": "Community and Social Service",
 "Religion": "Shinto",
 "Sexuality": "Heterosexual",
 "anxious - calm": "extremely anxious",
 "apolitical - activist": "moderately apolitical",
 "asexual - hypersexual": "moderately asexual",
 "authoritarian - libertarian": "extremely libertarian",
 "competitive - collaborative": "moderately collaborative",
 "conservative - progressive": "mildly conservative",
 "destitute - wealthy": "mildly destitute",
 "difficult childhood - stable childhood": "moderately stable childhood",
 "emotionally cold - loving": "mildly loving",
 "emotionally sensitive - emotionally robust": "extremely emotionally robust",
 "gullible - critical": "extremely gullible",
 "impulsive - thoughtful": "extremely impulsive",
 "incurious - curious": "extremely curious",
 "individualist - collectivist": "mildly collectivist",
 "introverted - extroverted": "mildly introverted",
 "lazy - ambitious": "moderately lazy",
 "misogynistic - egalitarian": "mildly misogynistic",
 "pessimistic - optimistic": "mildly optimistic",
 "profile": "Education: Skilled Trade\nGender Expression: Transgender Female\nGenetic Population: Scandinavian\nOccupation: Community and Social Service\nReligion: Shinto\nSexuality: Heterosexual\nI am extremely generous.\nI am extremely curious.\nI am extremely secular.\nI am mildly optimistic.\nI am extremely gullible.\nI am moderately forgiving.\nI am moderately lazy.\nI am mildly introverted.\nI am extremely serious.\nI am mildly stubborn.\nI am extremely impulsive.\nI am extremely libertarian.\nI am mildly conservative.\nI am moderately apolitical.\nI am mildly misogynistic.\nI am extremely inclusive.\nI am extremely anxious.\nI am moderately vain.\nI am extremely violent.\nI am extremely kind.\nI am extremely emotionally robust.\nI am mildly unhealthy.\nI am moderately traditional.\nI am moderately asexual.\nI am moderately collaborative.\nI am mildly collectivist.\nI am mildly loving.\nI am moderately stable childhood.\nI am moderately young.\nI am mildly destitute.\n",
 "racist - inclusive": "extremely inclusive",
 "secular - spiritual": "extremely secular",
 "selfish - generous": "extremely generous",
 "serious - playful": "extremely serious",
 "stubborn - flexible": "mildly stubborn",
 "traditional - contemporary": "moderately traditional",
 "unhealthy - healthy": "mildly unhealthy",
 "unkind - kind": "extremely kind",
 "vain - humble": "moderately vain",
 "vengeful - forgiving": "moderately forgiving",
 "violent - peaceful": "extremely violent",
 "young - old": "moderately young"
}