{
 "Education": "Postsecondary Education",
 "Gender Expression": "Cisgendered Male",
 "Genetic Population": "Mediterranean",
 "Occupation": "Legal",
 "Religion": "Humanist or Secularist",
 "Sexuality": "Homosexual",
 "anxious - calm": "moderately anxious",
 "apolitical - activist": "mildly activist",
 "asexual - hypersexual": "mildly hypersexual",
 "authoritarian - libertarian": "mildly authoritarian",
 "competitive - collaborative": "moderately competitive",
 "conservative - progressive": "extremely progressive",
 "destitute - wealthy": "moderately destitute",
 "difficult childhood - stable childhood": "mildly difficult childhood",
 "emotionally cold - loving": "mildly emotionally cold",
 "emotionally sensitive - emotionally robust": "extremely emotionally sensitive",
 "gullible - critical": "mildly gullible",
 "impulsive - thoughtful": "mildly thoughtful",
 "incurious - curious": "moderately incurious",
 "individualist - collectivist": "moderately individualist",
 "introverted - extroverted": "moderately introverted",
 "lazy - ambitious": "moderately lazy",
 "misogynistic - egalitarian": "moderately egalitarian",
 "pessimistic - optimistic": "extremely pessimistic",
 "profile": "Education: Postsecondary Education\nGender Expression: Cisgendered Male\nGenetic Population: Mediterranean\nOccupation: Legal\nReligion: Humanist or Secularist\nSexuality: Homosexual\nI am extremely generous.\nI am moderately incurious.\nI am mildly secular.\nI am extremely pessimistic.\nI am mildly gullible.\nI am moderately vengeful.\nI am moderately lazy.\nI am moderately introverted.\nI am mildly playful.\nI am mildly stubborn.\nI am mildly thoughtful.\nI am mildly authoritarian.\nI am extremely progressive.\nI am mildly activist.\nI am moderately egalitarian.\nI am mildly inclusive.\nI am moderately anxious.\nI am mildly vain.\nI am moderately violent.\nI am mildly unkind.\nI am extremely emotionally sensitive.\nI am extremely healthy.\nI am moderately traditional.\nI am mildly hypersexual.\nI am moderately competitive.\nI am moderately individualist.\nI am mildly emotionally cold.\nI am mildly difficult childhood.\nI am moderately young.\nI am moderately destitute.\n",
 "racist - inclusive": "mildly inclusive",
 "secular - spiritual": "mildly secular",
 "selfish - generous": "extremely generous",
 "serious - playful": "mildly playful",
 "stubborn - flexible": "mildly stubborn",
 "traditional - contemporary": "moderately traditional",
 "unhealthy - healthy": "extremely healthy",
 "unkind - kind": "mildly unkind",
 "vain - humble": "mildly vain",
 "vengeful - forgiving": "moderately vengeful",
 "violent - peaceful": "moderately violent",
 "young - old": "moderately young"
}