{
 "Education": "No Schooling",
 "Gender Expression": "Transgender Female",
 "Genetic Population": "South Asian",
 "Occupation": "Farming, Fishing, and Forestry",
 "Religion": "Sufism",
 "Sexuality": "Homosexual",
 "anxious - calm": "moderately anxious",
 "apolitical - activist": "moderately activist",
 "asexual - hypersexual": "mildly asexual",
 "authoritarian - libertarian": "mildly libertarian",
 "competitive - collaborative": "mildly collaborative",
 "conservative - progressive": "extremely progressive",
 "destitute - wealthy": "moderately wealthy",
 "difficult childhood - stable childhood": "mildly difficult childhood",
 "emotionally cold - loving": "moderately loving",
 "emotionally sensitive - emotionally robust": "moderately emotionally sensitive",
 "gullible - critical": "extremely gullible",
 "impulsive - thoughtful": "moderately impulsive",
 "incurious - curious": "mildly curious",
 "individualist - collectivist": "moderately collectivist",
 "introverted - extroverted": "extremely introverted",
 "lazy - ambitious": "moderately lazy",
 "misogynistic - egalitarian": "mildly egalitarian",
 "pessimistic - optimistic": "moderately optimistic",
 "profile": "Education: No Schooling\nGender Expression: Transgender Female\nGenetic Population: South Asian\nOccupation: Farming, Fishing, and Forestry\nReligion: Sufism\nSexuality: Homosexual\nI am extremely selfish.\nI am mildly curious.\nI am extremely secular.\nI am moderately optimistic.\nI am extremely gullible.\nI am mildly vengeful.\nI am moderately lazy.\nI am extremely introverted.\nI am extremely playful.\nI am mildly stubborn.\nI am moderately impulsive.\nI am mildly libertarian.\nI am extremely progressive.\nI am moderately activist.\nI am mildly egalitarian.\nI am moderately inclusive.\nI am moderately anxious.\nI am extremely humble.\nI am moderately violent.\nI am mildly unkind.\nI am moderately emotionally sensitive.\nI am moderately unhealthy.\nI am moderately traditional.\nI am mildly asexual.\nI am mildly collaborative.\nI am moderately collectivist.\nI am moderately loving.\nI am mildly difficult childhood.\nI am moderately old.\nI am moderately wealthy.\n",
 "racist - inclusive": "moderately inclusive",
 "secular - spiritual": "extremely secular",
 "selfish - generous": "extremely selfish",
 "serious - playful": "extremely playful",
 "stubborn - flexible": "mildly stubborn",
 "traditional - contemporary": "moderately traditional",
 "unhealthy - healthy": "moderately unhealthy",
 "unkind - kind": "mildly unkind",
 "vain - humble": "extremely humble",
 "vengeful - forgiving": "mildly vengeful",
 "violent - peaceful": "moderately violent",
 "young - old": "moderately old"
}