{
 "Education": "Postsecondary Education",
 "Gender Expression": "Non-binary Male",
 "Genetic Population": "Scandinavian",
 "Occupation": "Unemployed",
 "Religion": "Jainism",
 "Sexuality": "Homosexual",
 "anxious - calm": "extremely anxious",
 "apolitical - activist": "moderately apolitical",
 "asexual - hypersexual": "mildly hypersexual",
 "authoritarian - libertarian": "extremely libertarian",
 "competitive - collaborative": "mildly competitive",
 "conservative - progressive": "moderately progressive",
 "destitute - wealthy": "mildly destitute",
 "difficult childhood - stable childhood": "moderately stable childhood",
 "emotionally cold - loving": "moderately emotionally cold",
 "emotionally sensitive - emotionally robust": "mildly emotionally robust",
 "gullible - critical": "moderately gullible",
 "impulsive - thoughtful": "moderately thoughtful",
 "incurious - curious": "moderately curious",
 "individualist - collectivist": "extremely collectivist",
 "introverted - extroverted": "mildly extroverted",
 "lazy - ambitious": "moderately ambitious",
 "misogynistic - egalitarian": "moderately misogynistic",
 "pessimistic - optimistic": "moderately pessimistic",
 "profile": "Education: Postsecondary Education\nGender Expression: Non-binary Male\nGenetic Population: Scandinavian\nOccupation: Unemployed\nReligion: Jainism\nSexuality: Homosexual\nI am mildly selfish.\nI am moderately curious.\nI am extremely spiritual.\nI am moderately pessimistic.\nI am moderately gullible.\nI am moderately forgiving.\nI am moderately ambitious.\nI am mildly extroverted.\nI am mildly serious.\nI am mildly stubborn.\nI am moderately thoughtful.\nI am extremely libertarian.\nI am moderately progressive.\nI am moderately apolitical.\nI am moderately misogynistic.\nI am moderately racist.\nI am extremely anxious.\nI am mildly humble.\nI am mildly peaceful.\nI am moderately kind.\nI am mildly emotionally robust.\nI am mildly unhealthy.\nI am moderately contemporary.\nI am mildly hypersexual.\nI am mildly competitive.\nI am extremely collectivist.\nI am moderately emotionally cold.\nI am moderately stable childhood.\nI am extremely young.\nI am mildly destitute.\n",
 "racist - inclusive": "moderately racist",
 "secular - spiritual": "extremely spiritual",
 "selfish - generous": "mildly selfish",
 "serious - playful": "mildly serious",
 "stubborn - flexible": "mildly stubborn",
 "traditional - contemporary": "moderately contemporary",
 "unhealthy - healthy": "mildly unhealthy",
 "unkind - kind": "moderately kind",
 "vain - humble": "mildly humble",
 "vengeful - forgiving": "moderately forgiving",
 "violent - peaceful": "mildly peaceful",
 "young - old": "extremely young"
}