{
 "Education": "Home Schooling",
 "Gender Expression": "Genderqueer Female",
 "Genetic Population": "Australian",
 "Occupation": "Building and Grounds Cleaning and Maintenance",
 "Religion": "Islam",
 "Sexuality": "Homosexual",
 "anxious - calm": "extremely calm",
 "apolitical - activist": "moderately apolitical",
 "asexual - hypersexual": "moderately asexual",
 "authoritarian - libertarian": "extremely authoritarian",
 "competitive - collaborative": "mildly competitive",
 "conservative - progressive": "extremely progressive",
 "destitute - wealthy": "moderately destitute",
 "difficult childhood - stable childhood": "mildly difficult childhood",
 "emotionally cold - loving": "moderately loving",
 "emotionally sensitive - emotionally robust": "moderately emotionally sensitive",
 "gullible - critical": "moderately critical",
 "impulsive - thoughtful": "mildly thoughtful",
 "incurious - curious": "mildly incurious",
 "individualist - collectivist": "mildly collectivist",
 "introverted - extroverted": "moderately introverted",
 "lazy - ambitious": "mildly lazy",
 "misogynistic - egalitarian": "extremely misogynistic",
 "pessimistic - optimistic": "moderately pessimistic",
 "profile": "Education: Home Schooling\nGender Expression: Genderqueer Female\nGenetic Population: Australian\nOccupation: Building and Grounds Cleaning and Maintenance\nReligion: Islam\nSexuality: Homosexual\nI am extremely selfish.\nI am mildly incurious.\nI am extremely spiritual.\nI am moderately pessimistic.\nI am moderately critical.\nI am moderately forgiving.\nI am mildly lazy.\nI am moderately introverted.\nI am moderately playful.\nI am extremely flexible.\nI am mildly thoughtful.\nI am extremely authoritarian.\nI am extremely progressive.\nI am moderately apolitical.\nI am extremely misogynistic.\nI am moderately inclusive.\nI am extremely calm.\nI am extremely humble.\nI am moderately violent.\nI am moderately kind.\nI am moderately emotionally sensitive.\nI am moderately unhealthy.\nI am mildly traditional.\nI am moderately asexual.\nI am mildly competitive.\nI am mildly collectivist.\nI am moderately loving.\nI am mildly difficult childhood.\nI am mildly old.\nI am moderately destitute.\n",
 "racist - inclusive": "moderately inclusive",
 "secular - spiritual": "extremely spiritual",
 "selfish - generous": "extremely selfish",
 "serious - playful": "moderately playful",
 "stubborn - flexible": "extremely flexible",
 "traditional - contemporary": "mildly traditional",
 "unhealthy - healthy": "moderately unhealthy",
 "unkind - kind": "moderately kind",
 "vain - humble": "extremely humble",
 "vengeful - forgiving": "moderately forgiving",
 "violent - peaceful": "moderately violent",
 "young - old": "mildly old"
}