{
 "Education": "Primary Education",
 "Gender Expression": "Transgender Male",
 "Genetic Population": "Indigenous or Aboriginal",
 "Occupation": "Installation, Maintenance, and Repair",
 "Religion": "Zoroastrianism",
 "Sexuality": "Heterosexual",
 "anxious - calm": "extremely calm",
 "apolitical - activist": "mildly apolitical",
 "asexual - hypersexual": "extremely asexual",
 "authoritarian - libertarian": "extremely libertarian",
 "competitive - collaborative": "moderately collaborative",
 "conservative - progressive": "moderately progressive",
 "destitute - wealthy": "mildly destitute",
 "difficult childhood - stable childhood": "mildly difficult childhood",
 "emotionally cold - loving": "extremely loving",
 "emotionally sensitive - emotionally robust": "extremely emotionally robust",
 "gullible - critical": "extremely gullible",
 "impulsive - thoughtful": "extremely impulsive",
 "incurious - curious": "extremely incurious",
 "individualist - collectivist": "moderately individualist",
 "introverted - extroverted": "moderately introverted",
 "lazy - ambitious": "mildly ambitious",
 "misogynistic - egalitarian": "moderately misogynistic",
 "pessimistic - optimistic": "moderately optimistic",
 "profile": "Education: Primary Education\nGender Expression: Transgender Male\nGenetic Population: Indigenous or Aboriginal\nOccupation: Installation, Maintenance, and Repair\nReligion: Zoroastrianism\nSexuality: Heterosexual\nI am extremely generous.\nI am extremely incurious.\nI am mildly spiritual.\nI am moderately optimistic.\nI am extremely gullible.\nI am mildly vengeful.\nI am mildly ambitious.\nI am moderately introverted.\nI am mildly serious.\nI am moderately stubborn.\nI am extremely impulsive.\nI am extremely libertarian.\nI am moderately progressive.\nI am mildly apolitical.\nI am moderately misogynistic.\nI am extremely inclusive.\nI am extremely calm.\nI am moderately humble.\nI am extremely violent.\nI am mildly unkind.\nI am extremely emotionally robust.\nI am mildly healthy.\nI am extremely traditional.\nI am extremely asexual.\nI am moderately collaborative.\nI am moderately individualist.\nI am extremely loving.\nI am mildly difficult childhood.\nI am mildly young.\nI am mildly destitute.\n",
 "racist - inclusive": "extremely inclusive",
 "secular - spiritual": "mildly spiritual",
 "selfish - generous": "extremely generous",
 "serious - playful": "mildly serious",
 "stubborn - flexible": "moderately stubborn",
 "traditional - contemporary": "extremely traditional",
 "unhealthy - healthy": "mildly healthy",
 "unkind - kind": "mildly unkind",
 "vain - humble": "moderately humble",
 "vengeful - forgiving": "mildly vengeful",
 "violent - peaceful": "extremely violent",
 "young - old": "mildly young"
}