{
 "Education": "Primary Education",
 "Gender Expression": "Transgender Female",
 "Genetic Population": "Central American",
 "Occupation": "Educational Instruction and Library",
 "Religion": "Buddhism",
 "Sexuality": "Homosexual",
 "anxious - calm": "mildly anxious",
 "apolitical - activist": "moderately apolitical",
 "asexual - hypersexual": "extremely asexual",
 "authoritarian - libertarian": "moderately libertarian",
 "competitive - collaborative": "moderately collaborative",
 "conservative - progressive": "mildly progressive",
 "destitute - wealthy": "mildly destitute",
 "difficult childhood - stable childhood": "moderately stable childhood",
 "emotionally cold - loving": "moderately emotionally cold",
 "emotionally sensitive - emotionally robust": "extremely emotionally robust",
 "gullible - critical": "mildly gullible",
 "impulsive - thoughtful": "mildly thoughtful",
 "incurious - curious": "mildly incurious",
 "individualist - collectivist": "moderately collectivist",
 "introverted - extroverted": "moderately extroverted",
 "lazy - ambitious": "moderately ambitious",
 "misogynistic - egalitarian": "extremely misogynistic",
 "pessimistic - optimistic": "mildly pessimistic",
 "profile": "Education: Primary Education\nGender Expression: Transgender Female\nGenetic Population: Central American\nOccupation: Educational Instruction and Library\nReligion: Buddhism\nSexuality: Homosexual\nI am extremely generous.\nI am mildly incurious.\nI am mildly spiritual.\nI am mildly pessimistic.\nI am mildly gullible.\nI am extremely forgiving.\nI am moderately ambitious.\nI am moderately extroverted.\nI am mildly serious.\nI am mildly flexible.\nI am mildly thoughtful.\nI am moderately libertarian.\nI am mildly progressive.\nI am moderately apolitical.\nI am extremely misogynistic.\nI am extremely racist.\nI am mildly anxious.\nI am mildly vain.\nI am mildly peaceful.\nI am mildly unkind.\nI am extremely emotionally robust.\nI am extremely unhealthy.\nI am extremely traditional.\nI am extremely asexual.\nI am moderately collaborative.\nI am moderately collectivist.\nI am moderately emotionally cold.\nI am moderately stable childhood.\nI am moderately old.\nI am mildly destitute.\n",
 "racist - inclusive": "extremely racist",
 "secular - spiritual": "mildly spiritual",
 "selfish - generous": "extremely generous",
 "serious - playful": "mildly serious",
 "stubborn - flexible": "mildly flexible",
 "traditional - contemporary": "extremely traditional",
 "unhealthy - healthy": "extremely unhealthy",
 "unkind - kind": "mildly unkind",
 "vain - humble": "mildly vain",
 "vengeful - forgiving": "extremely forgiving",
 "violent - peaceful": "mildly peaceful",
 "young - old": "moderately old"
}