{
 "Education": "Primary Education",
 "Gender Expression": "Transgender Female",
 "Genetic Population": "South Asian",
 "Occupation": "Production",
 "Religion": "Buddhism",
 "Sexuality": "Homosexual",
 "anxious - calm": "moderately calm",
 "apolitical - activist": "extremely activist",
 "asexual - hypersexual": "moderately asexual",
 "authoritarian - libertarian": "mildly authoritarian",
 "competitive - collaborative": "extremely competitive",
 "conservative - progressive": "moderately conservative",
 "destitute - wealthy": "extremely wealthy",
 "difficult childhood - stable childhood": "moderately stable childhood",
 "emotionally cold - loving": "extremely emotionally cold",
 "emotionally sensitive - emotionally robust": "extremely emotionally robust",
 "gullible - critical": "mildly gullible",
 "impulsive - thoughtful": "moderately impulsive",
 "incurious - curious": "moderately incurious",
 "individualist - collectivist": "moderately individualist",
 "introverted - extroverted": "moderately introverted",
 "lazy - ambitious": "extremely ambitious",
 "misogynistic - egalitarian": "mildly misogynistic",
 "pessimistic - optimistic": "mildly pessimistic",
 "profile": "Education: Primary Education\nGender Expression: Transgender Female\nGenetic Population: South Asian\nOccupation: Production\nReligion: Buddhism\nSexuality: Homosexual\nI am extremely generous.\nI am moderately incurious.\nI am mildly spiritual.\nI am mildly pessimistic.\nI am mildly gullible.\nI am moderately vengeful.\nI am extremely ambitious.\nI am moderately introverted.\nI am moderately serious.\nI am mildly flexible.\nI am moderately impulsive.\nI am mildly authoritarian.\nI am moderately conservative.\nI am extremely activist.\nI am mildly misogynistic.\nI am mildly inclusive.\nI am moderately calm.\nI am moderately humble.\nI am extremely peaceful.\nI am mildly unkind.\nI am extremely emotionally robust.\nI am extremely healthy.\nI am mildly traditional.\nI am moderately asexual.\nI am extremely competitive.\nI am moderately individualist.\nI am extremely emotionally cold.\nI am moderately stable childhood.\nI am mildly young.\nI am extremely wealthy.\n",
 "racist - inclusive": "mildly inclusive",
 "secular - spiritual": "mildly spiritual",
 "selfish - generous": "extremely generous",
 "serious - playful": "moderately serious",
 "stubborn - flexible": "mildly flexible",
 "traditional - contemporary": "mildly traditional",
 "unhealthy - healthy": "extremely healthy",
 "unkind - kind": "mildly unkind",
 "vain - humble": "moderately humble",
 "vengeful - forgiving": "moderately vengeful",
 "violent - peaceful": "extremely peaceful",
 "young - old": "mildly young"
}