{
 "Education": "No Schooling",
 "Gender Expression": "Transgender Female",
 "Genetic Population": "East Asian",
 "Occupation": "Computer and Mathematical",
 "Religion": "Taoism",
 "Sexuality": "Bisexual",
 "anxious - calm": "mildly calm",
 "apolitical - activist": "moderately apolitical",
 "asexual - hypersexual": "mildly asexual",
 "authoritarian - libertarian": "moderately authoritarian",
 "competitive - collaborative": "extremely collaborative",
 "conservative - progressive": "extremely progressive",
 "destitute - wealthy": "mildly wealthy",
 "difficult childhood - stable childhood": "moderately stable childhood",
 "emotionally cold - loving": "mildly emotionally cold",
 "emotionally sensitive - emotionally robust": "mildly emotionally robust",
 "gullible - critical": "moderately critical",
 "impulsive - thoughtful": "mildly impulsive",
 "incurious - curious": "extremely incurious",
 "individualist - collectivist": "moderately individualist",
 "introverted - extroverted": "extremely extroverted",
 "lazy - ambitious": "extremely lazy",
 "misogynistic - egalitarian": "moderately egalitarian",
 "pessimistic - optimistic": "moderately optimistic",
 "profile": "Education: No Schooling\nGender Expression: Transgender Female\nGenetic Population: East Asian\nOccupation: Computer and Mathematical\nReligion: Taoism\nSexuality: Bisexual\nI am extremely selfish.\nI am extremely incurious.\nI am mildly secular.\nI am moderately optimistic.\nI am moderately critical.\nI am mildly vengeful.\nI am extremely lazy.\nI am extremely extroverted.\nI am mildly playful.\nI am moderately flexible.\nI am mildly impulsive.\nI am moderately authoritarian.\nI am extremely progressive.\nI am moderately apolitical.\nI am moderately egalitarian.\nI am moderately racist.\nI am mildly calm.\nI am mildly humble.\nI am extremely violent.\nI am extremely unkind.\nI am mildly emotionally robust.\nI am moderately unhealthy.\nI am extremely traditional.\nI am mildly asexual.\nI am extremely collaborative.\nI am moderately individualist.\nI am mildly emotionally cold.\nI am moderately stable childhood.\nI am mildly old.\nI am mildly wealthy.\n",
 "racist - inclusive": "moderately racist",
 "secular - spiritual": "mildly secular",
 "selfish - generous": "extremely selfish",
 "serious - playful": "mildly playful",
 "stubborn - flexible": "moderately flexible",
 "traditional - contemporary": "extremely traditional",
 "unhealthy - healthy": "moderately unhealthy",
 "unkind - kind": "extremely unkind",
 "vain - humble": "mildly humble",
 "vengeful - forgiving": "mildly vengeful",
 "violent - peaceful": "extremely violent",
 "young - old": "mildly old"
}