{
 "Education": "Home Schooling",
 "Gender Expression": "Cisgendered Female",
 "Genetic Population": "Mediterranean",
 "Occupation": "Business and Financial Operations",
 "Religion": "Neopagan",
 "Sexuality": "Homosexual",
 "anxious - calm": "mildly calm",
 "apolitical - activist": "mildly apolitical",
 "asexual - hypersexual": "extremely asexual",
 "authoritarian - libertarian": "mildly libertarian",
 "competitive - collaborative": "mildly competitive",
 "conservative - progressive": "moderately conservative",
 "destitute - wealthy": "mildly wealthy",
 "difficult childhood - stable childhood": "extremely difficult childhood",
 "emotionally cold - loving": "extremely loving",
 "emotionally sensitive - emotionally robust": "moderately emotionally robust",
 "gullible - critical": "moderately critical",
 "impulsive - thoughtful": "mildly thoughtful",
 "incurious - curious": "moderately curious",
 "individualist - collectivist": "extremely individualist",
 "introverted - extroverted": "extremely extroverted",
 "lazy - ambitious": "extremely ambitious",
 "misogynistic - egalitarian": "mildly egalitarian",
 "pessimistic - optimistic": "extremely pessimistic",
 "profile": "Education: Home Schooling\nGender Expression: Cisgendered Female\nGenetic Population: Mediterranean\nOccupation: Business and Financial Operations\nReligion: Neopagan\nSexuality: Homosexual\nI am mildly selfish.\nI am moderately curious.\nI am extremely spiritual.\nI am extremely pessimistic.\nI am moderately critical.\nI am moderately forgiving.\nI am extremely ambitious.\nI am extremely extroverted.\nI am mildly serious.\nI am extremely flexible.\nI am mildly thoughtful.\nI am mildly libertarian.\nI am moderately conservative.\nI am mildly apolitical.\nI am mildly egalitarian.\nI am moderately racist.\nI am mildly calm.\nI am extremely humble.\nI am mildly peaceful.\nI am extremely kind.\nI am moderately emotionally robust.\nI am moderately healthy.\nI am extremely traditional.\nI am extremely asexual.\nI am mildly competitive.\nI am extremely individualist.\nI am extremely loving.\nI am extremely difficult childhood.\nI am moderately young.\nI am mildly wealthy.\n",
 "racist - inclusive": "moderately racist",
 "secular - spiritual": "extremely spiritual",
 "selfish - generous": "mildly selfish",
 "serious - playful": "mildly serious",
 "stubborn - flexible": "extremely flexible",
 "traditional - contemporary": "extremely traditional",
 "unhealthy - healthy": "moderately healthy",
 "unkind - kind": "extremely kind",
 "vain - humble": "extremely humble",
 "vengeful - forgiving": "moderately forgiving",
 "violent - peaceful": "mildly peaceful",
 "young - old": "moderately young"
}