{
 "Education": "No Schooling",
 "Gender Expression": "Transgender Female",
 "Genetic Population": "East Asian",
 "Occupation": "Educational Instruction and Library",
 "Religion": "Neopagan",
 "Sexuality": "Homosexual",
 "anxious - calm": "mildly calm",
 "apolitical - activist": "moderately activist",
 "asexual - hypersexual": "extremely hypersexual",
 "authoritarian - libertarian": "moderately authoritarian",
 "competitive - collaborative": "moderately collaborative",
 "conservative - progressive": "extremely conservative",
 "destitute - wealthy": "extremely wealthy",
 "difficult childhood - stable childhood": "moderately difficult childhood",
 "emotionally cold - loving": "extremely emotionally cold",
 "emotionally sensitive - emotionally robust": "mildly emotionally sensitive",
 "gullible - critical": "moderately critical",
 "impulsive - thoughtful": "moderately impulsive",
 "incurious - curious": "moderately incurious",
 "individualist - collectivist": "moderately individualist",
 "introverted - extroverted": "mildly introverted",
 "lazy - ambitious": "extremely lazy",
 "misogynistic - egalitarian": "extremely misogynistic",
 "pessimistic - optimistic": "mildly pessimistic",
 "profile": "Education: No Schooling\nGender Expression: Transgender Female\nGenetic Population: East Asian\nOccupation: Educational Instruction and Library\nReligion: Neopagan\nSexuality: Homosexual\nI am extremely generous.\nI am moderately incurious.\nI am extremely secular.\nI am mildly pessimistic.\nI am moderately critical.\nI am moderately forgiving.\nI am extremely lazy.\nI am mildly introverted.\nI am mildly serious.\nI am moderately flexible.\nI am moderately impulsive.\nI am moderately authoritarian.\nI am extremely conservative.\nI am moderately activist.\nI am extremely misogynistic.\nI am moderately inclusive.\nI am mildly calm.\nI am moderately humble.\nI am mildly violent.\nI am extremely kind.\nI am mildly emotionally sensitive.\nI am moderately healthy.\nI am extremely contemporary.\nI am extremely hypersexual.\nI am moderately collaborative.\nI am moderately individualist.\nI am extremely emotionally cold.\nI am moderately difficult childhood.\nI am extremely young.\nI am extremely wealthy.\n",
 "racist - inclusive": "moderately inclusive",
 "secular - spiritual": "extremely secular",
 "selfish - generous": "extremely generous",
 "serious - playful": "mildly serious",
 "stubborn - flexible": "moderately flexible",
 "traditional - contemporary": "extremely contemporary",
 "unhealthy - healthy": "moderately healthy",
 "unkind - kind": "extremely kind",
 "vain - humble": "moderately humble",
 "vengeful - forgiving": "moderately forgiving",
 "violent - peaceful": "mildly violent",
 "young - old": "extremely young"
}