{
 "Education": "Home Schooling",
 "Gender Expression": "Cisgendered Male",
 "Genetic Population": "South American",
 "Occupation": "Healthcare Practitioners and Technical",
 "Religion": "Hinduism",
 "Sexuality": "Homosexual",
 "anxious - calm": "mildly anxious",
 "apolitical - activist": "extremely apolitical",
 "asexual - hypersexual": "extremely asexual",
 "authoritarian - libertarian": "mildly authoritarian",
 "competitive - collaborative": "extremely competitive",
 "conservative - progressive": "mildly progressive",
 "destitute - wealthy": "mildly destitute",
 "difficult childhood - stable childhood": "moderately difficult childhood",
 "emotionally cold - loving": "extremely emotionally cold",
 "emotionally sensitive - emotionally robust": "mildly emotionally robust",
 "gullible - critical": "mildly gullible",
 "impulsive - thoughtful": "extremely thoughtful",
 "incurious - curious": "extremely incurious",
 "individualist - collectivist": "mildly individualist",
 "introverted - extroverted": "moderately introverted",
 "lazy - ambitious": "mildly lazy",
 "misogynistic - egalitarian": "extremely egalitarian",
 "pessimistic - optimistic": "extremely optimistic",
 "profile": "Education: Home Schooling\nGender Expression: Cisgendered Male\nGenetic Population: South American\nOccupation: Healthcare Practitioners and Technical\nReligion: Hinduism\nSexuality: Homosexual\nI am mildly generous.\nI am extremely incurious.\nI am moderately spiritual.\nI am extremely optimistic.\nI am mildly gullible.\nI am extremely forgiving.\nI am mildly lazy.\nI am moderately introverted.\nI am mildly playful.\nI am mildly flexible.\nI am extremely thoughtful.\nI am mildly authoritarian.\nI am mildly progressive.\nI am extremely apolitical.\nI am extremely egalitarian.\nI am mildly racist.\nI am mildly anxious.\nI am mildly vain.\nI am mildly violent.\nI am moderately kind.\nI am mildly emotionally robust.\nI am moderately unhealthy.\nI am extremely traditional.\nI am extremely asexual.\nI am extremely competitive.\nI am mildly individualist.\nI am extremely emotionally cold.\nI am moderately difficult childhood.\nI am extremely young.\nI am mildly destitute.\n",
 "racist - inclusive": "mildly racist",
 "secular - spiritual": "moderately spiritual",
 "selfish - generous": "mildly generous",
 "serious - playful": "mildly playful",
 "stubborn - flexible": "mildly flexible",
 "traditional - contemporary": "extremely traditional",
 "unhealthy - healthy": "moderately unhealthy",
 "unkind - kind": "moderately kind",
 "vain - humble": "mildly vain",
 "vengeful - forgiving": "extremely forgiving",
 "violent - peaceful": "mildly violent",
 "young - old": "extremely young"
}