{
 "Education": "Primary Education",
 "Gender Expression": "Non-binary Male",
 "Genetic Population": "South Asian",
 "Occupation": "Educational Instruction and Library",
 "Religion": "Hinduism",
 "Sexuality": "Homosexual",
 "anxious - calm": "moderately anxious",
 "apolitical - activist": "mildly activist",
 "asexual - hypersexual": "mildly asexual",
 "authoritarian - libertarian": "mildly libertarian",
 "competitive - collaborative": "extremely competitive",
 "conservative - progressive": "extremely progressive",
 "destitute - wealthy": "mildly destitute",
 "difficult childhood - stable childhood": "extremely stable childhood",
 "emotionally cold - loving": "moderately loving",
 "emotionally sensitive - emotionally robust": "extremely emotionally robust",
 "gullible - critical": "extremely critical",
 "impulsive - thoughtful": "mildly thoughtful",
 "incurious - curious": "extremely curious",
 "individualist - collectivist": "extremely collectivist",
 "introverted - extroverted": "moderately introverted",
 "lazy - ambitious": "moderately lazy",
 "misogynistic - egalitarian": "moderately egalitarian",
 "pessimistic - optimistic": "moderately optimistic",
 "profile": "Education: Primary Education\nGender Expression: Non-binary Male\nGenetic Population: South Asian\nOccupation: Educational Instruction and Library\nReligion: Hinduism\nSexuality: Homosexual\nI am extremely selfish.\nI am extremely curious.\nI am mildly spiritual.\nI am moderately optimistic.\nI am extremely critical.\nI am moderately vengeful.\nI am moderately lazy.\nI am moderately introverted.\nI am mildly serious.\nI am mildly stubborn.\nI am mildly thoughtful.\nI am mildly libertarian.\nI am extremely progressive.\nI am mildly activist.\nI am moderately egalitarian.\nI am extremely inclusive.\nI am moderately anxious.\nI am extremely humble.\nI am extremely peaceful.\nI am moderately unkind.\nI am extremely emotionally robust.\nI am mildly unhealthy.\nI am moderately traditional.\nI am mildly asexual.\nI am extremely competitive.\nI am extremely collectivist.\nI am moderately loving.\nI am extremely stable childhood.\nI am moderately young.\nI am mildly destitute.\n",
 "racist - inclusive": "extremely inclusive",
 "secular - spiritual": "mildly spiritual",
 "selfish - generous": "extremely selfish",
 "serious - playful": "mildly serious",
 "stubborn - flexible": "mildly stubborn",
 "traditional - contemporary": "moderately traditional",
 "unhealthy - healthy": "mildly unhealthy",
 "unkind - kind": "moderately unkind",
 "vain - humble": "extremely humble",
 "vengeful - forgiving": "moderately vengeful",
 "violent - peaceful": "extremely peaceful",
 "young - old": "moderately young"
}