{
 "Education": "Home Schooling",
 "Gender Expression": "Genderqueer Female",
 "Genetic Population": "South American",
 "Occupation": "Architecture and Engineering",
 "Religion": "Sufism",
 "Sexuality": "Heterosexual",
 "anxious - calm": "extremely calm",
 "apolitical - activist": "extremely apolitical",
 "asexual - hypersexual": "moderately asexual",
 "authoritarian - libertarian": "extremely libertarian",
 "competitive - collaborative": "extremely competitive",
 "conservative - progressive": "extremely conservative",
 "destitute - wealthy": "moderately destitute",
 "difficult childhood - stable childhood": "mildly difficult childhood",
 "emotionally cold - loving": "extremely emotionally cold",
 "emotionally sensitive - emotionally robust": "moderately emotionally robust",
 "gullible - critical": "extremely gullible",
 "impulsive - thoughtful": "extremely impulsive",
 "incurious - curious": "extremely incurious",
 "individualist - collectivist": "moderately individualist",
 "introverted - extroverted": "extremely extroverted",
 "lazy - ambitious": "mildly ambitious",
 "misogynistic - egalitarian": "mildly egalitarian",
 "pessimistic - optimistic": "moderately optimistic",
 "profile": "Education: Home Schooling\nGender Expression: Genderqueer Female\nGenetic Population: South American\nOccupation: Architecture and Engineering\nReligion: Sufism\nSexuality: Heterosexual\nI am moderately selfish.\nI am extremely incurious.\nI am extremely spiritual.\nI am moderately optimistic.\nI am extremely gullible.\nI am mildly forgiving.\nI am mildly ambitious.\nI am extremely extroverted.\nI am extremely playful.\nI am moderately stubborn.\nI am extremely impulsive.\nI am extremely libertarian.\nI am extremely conservative.\nI am extremely apolitical.\nI am mildly egalitarian.\nI am extremely racist.\nI am extremely calm.\nI am mildly vain.\nI am mildly peaceful.\nI am mildly unkind.\nI am moderately emotionally robust.\nI am mildly healthy.\nI am mildly contemporary.\nI am moderately asexual.\nI am extremely competitive.\nI am moderately individualist.\nI am extremely emotionally cold.\nI am mildly difficult childhood.\nI am extremely young.\nI am moderately destitute.\n",
 "racist - inclusive": "extremely racist",
 "secular - spiritual": "extremely spiritual",
 "selfish - generous": "moderately selfish",
 "serious - playful": "extremely playful",
 "stubborn - flexible": "moderately stubborn",
 "traditional - contemporary": "mildly contemporary",
 "unhealthy - healthy": "mildly healthy",
 "unkind - kind": "mildly unkind",
 "vain - humble": "mildly vain",
 "vengeful - forgiving": "mildly forgiving",
 "violent - peaceful": "mildly peaceful",
 "young - old": "extremely young"
}