{
 "Education": "Postsecondary Education",
 "Gender Expression": "Genderqueer Male",
 "Genetic Population": "Sub-Saharan African",
 "Occupation": "Installation, Maintenance, and Repair",
 "Religion": "Neopagan",
 "Sexuality": "Homosexual",
 "anxious - calm": "moderately anxious",
 "apolitical - activist": "moderately activist",
 "asexual - hypersexual": "moderately asexual",
 "authoritarian - libertarian": "mildly libertarian",
 "competitive - collaborative": "mildly collaborative",
 "conservative - progressive": "extremely progressive",
 "destitute - wealthy": "extremely wealthy",
 "difficult childhood - stable childhood": "extremely stable childhood",
 "emotionally cold - loving": "extremely loving",
 "emotionally sensitive - emotionally robust": "moderately emotionally robust",
 "gullible - critical": "mildly critical",
 "impulsive - thoughtful": "mildly impulsive",
 "incurious - curious": "mildly curious",
 "individualist - collectivist": "moderately individualist",
 "introverted - extroverted": "mildly introverted",
 "lazy - ambitious": "mildly lazy",
 "misogynistic - egalitarian": "mildly egalitarian",
 "pessimistic - optimistic": "mildly optimistic",
 "profile": "Education: Postsecondary Education\nGender Expression: Genderqueer Male\nGenetic Population: Sub-Saharan African\nOccupation: Installation, Maintenance, and Repair\nReligion: Neopagan\nSexuality: Homosexual\nI am extremely generous.\nI am mildly curious.\nI am extremely spiritual.\nI am mildly optimistic.\nI am mildly critical.\nI am extremely vengeful.\nI am mildly lazy.\nI am mildly introverted.\nI am moderately playful.\nI am mildly flexible.\nI am mildly impulsive.\nI am mildly libertarian.\nI am extremely progressive.\nI am moderately activist.\nI am mildly egalitarian.\nI am mildly racist.\nI am moderately anxious.\nI am extremely humble.\nI am mildly violent.\nI am moderately kind.\nI am moderately emotionally robust.\nI am extremely unhealthy.\nI am moderately traditional.\nI am moderately asexual.\nI am mildly collaborative.\nI am moderately individualist.\nI am extremely loving.\nI am extremely stable childhood.\nI am moderately young.\nI am extremely wealthy.\n",
 "racist - inclusive": "mildly racist",
 "secular - spiritual": "extremely spiritual",
 "selfish - generous": "extremely generous",
 "serious - playful": "moderately playful",
 "stubborn - flexible": "mildly flexible",
 "traditional - contemporary": "moderately traditional",
 "unhealthy - healthy": "extremely unhealthy",
 "unkind - kind": "moderately kind",
 "vain - humble": "extremely humble",
 "vengeful - forgiving": "extremely vengeful",
 "violent - peaceful": "mildly violent",
 "young - old": "moderately young"
}